isbn,book_title,author,class_title,professor
9780618871711,Fun Home: A Family Tragicomic,"Bechdel, Alison",Our Culture War over Gender Identity,Richard Nunan
9781541672895,Sexing the Body,"Fausto-Sterling, Anne",Our Culture War over Gender Identity,Richard Nunan
9781580056229,Whipping Girl: A Transsexual Woman on Sexism and the Scapegoating of Femininity,"Serano, Julia",Our Culture War over Gender Identity,Richard Nunan
9781442216716,The Philosophy of Sex,"Power, Nicholas - Halwani, Raja - Soble, Alan",Philosophy of Sex and Sexual Orientation,John Corvino
9780465015146,Courting Justice: Gay Men And Lesbians V. The Supreme Court,"Price, Deb","Lesbian, Gay, & Transgender Rights",Richard Nunan
9780700616374,The Sodomy Cases: Bowers V. Hardwick and Lawrence V. Texas (Landmark Law Cases and American Society),"Richards, David A. J.","Lesbian, Gay, & Transgender Rights",Richard Nunan
9780385721974,"The Riddle of Gender: Science, Activism, and Transgender Rights","Rudacille, Deborah","Lesbian, Gay, & Transgender Rights",Richard Nunan
